{"id": 0, "timestamp": "2026-03-30T19:00:00Z", "hypothesis": "Baseline Phase 2 with foundation Axis weights + 30 PU bid", "variable": "baseline", "old_value": "n/a", "new_value": "foundation_v1 + 30 PU bid + 3x Axis epochs", "type": "deterministic", "optimization_mode": "GROWING_DATA", "primary_metric": 0.942, "primary_metric_prev": 0.93, "delta": "+0.012", "decision": "discard", "notes": "94% Allied — Axis foundation weights too passive, not learning"}
{"id": 1, "timestamp": "2026-03-30T19:10:00Z", "hypothesis": "Random Axis weights will explore more aggressively with +30 PU budget, dropping Allied win rate toward sweet spot", "variable": "train_phase2.py:87-89 (Axis weight init)", "old_value": "load foundation Axis weights", "new_value": "random initialization", "type": "deterministic", "optimization_mode": "MICRO", "primary_metric": 0.82, "primary_metric_prev": 0.942, "delta": "-0.122", "decision": "monitoring", "notes": "Immediate drop from 94% to 82%. Random Axis with +30 PU bid is more competitive. Need 50+ iterations to confirm trend."}
{"id": 2, "timestamp": "2026-03-30T19:40:00Z", "hypothesis": "Higher Axis entropy (0.05 vs 0.02) will force diverse strategies, preventing Axis from collapsing to one predictable pattern that Allied easily counters", "variable": "train_selfplay_v3.py:291 (Axis ent_coeff)", "old_value": "0.02", "new_value": "0.05", "type": "deterministic", "optimization_mode": "MICRO", "primary_metric": 0.80, "primary_metric_prev": 0.859, "delta": "-0.059", "decision": "monitoring", "notes": "Allied dropped from 86% to 80% at iteration 15. Axis exploring more with higher entropy + random init + 30 PU bid + 3x epochs. Need 50+ iterations to confirm."}
{"id": 3, "timestamp": "2026-03-30T20:10:00Z", "hypothesis": "Increasing Axis bid from +30 to +38 PUs will give Axis enough economic advantage to break through the 83% plateau. Germany at 54 PUs/turn (vs standard 37) should enable a serious Barbarossa push.", "variable": "train_phase2.py:30-32 (Axis bid)", "old_value": "+30 (J+10, G+14, I+6)", "new_value": "+38 (J+13, G+17, I+8)", "type": "deterministic", "optimization_mode": "MICRO", "primary_metric": 0.82, "primary_metric_prev": 0.827, "delta": "-0.007", "decision": "monitoring", "notes": "Early result at iteration 15: 82%. Previous experiment plateaued at 83% with +30 bid. The extra 8 PUs should compound over rounds. Need 50+ iterations to see if Axis uses the extra budget to create real pressure."}
{"id": 4, "timestamp": "2026-03-30T20:35:00Z", "hypothesis": "Axis 3x VC reward (6.0 vs 2.0) will incentivize aggressive pushes toward Moscow/London/capitals instead of scattered skirmishing. This MACRO change addresses the root cause: Axis has money but no strategic direction.", "variable": "rust_engine/src/lib.rs (Axis VC reward multiplier in step_single + step_all)", "old_value": "2.0", "new_value": "6.0", "type": "deterministic", "optimization_mode": "MACRO", "primary_metric": 0.828, "primary_metric_prev": 0.828, "delta": "0.000 (just started)", "decision": "monitoring", "notes": "3 consecutive MICRO experiments plateaued at 83%. Switching to MACRO. Axis gets 3x reward for VC captures, unchanged for Allied. Should produce more aggressive/directed Axis play."}
{"id": 5, "timestamp": "2026-03-30T20:50:00Z", "hypothesis": "Monitor check: Axis 3x VC reward (Exp #4) is working — win rate dropped to 74%, approaching sweet spot. No change needed.", "variable": "none (monitoring)", "old_value": "n/a", "new_value": "n/a", "type": "deterministic", "optimization_mode": "GROWING_DATA", "primary_metric": 0.74, "primary_metric_prev": 0.828, "delta": "-0.088", "decision": "keep", "notes": "Exp #4 (MACRO: Axis 3x VC reward) is the first change to break below 80%. Allied at 74% after 175 iterations / 69k games. Approaching sweet spot (55-70%). Let it continue training."}
{"id": 6, "timestamp": "2026-03-30T21:00:00Z", "hypothesis": "Increasing Axis PPO epochs from 3x to 5x will give Axis more learning per game, pushing Allied win rate from 76% into the 55-70% sweet spot. Combined with 3x VC reward + random init + 38 bid + 0.05 entropy.", "variable": "train_selfplay_v3.py:291 (Axis epochs_override)", "old_value": "num_epochs * 3", "new_value": "num_epochs * 5", "type": "deterministic", "optimization_mode": "MICRO", "primary_metric": 0.80, "primary_metric_prev": 0.76, "delta": "+0.04 (early, just started)", "decision": "monitoring", "notes": "Speed dropped from 5.4k to 4.1k sps due to more GPU work. Allied at 80% early — need 50+ iterations. If this drops below 70%, next experiment triggers LEAGUE TRAINING (highest human priority)."}
{"id": 7, "timestamp": "2026-03-30T21:20:00Z", "hypothesis": "LEAGUE TRAINING: Allied faces diverse Axis opponents (50% current, 30% past snapshots, 20% random). Prevents strategy collapse. League activates at iteration 100 (after 2 snapshots). This is human priority #1.", "variable": "train_selfplay_v3.py (league opponent selection)", "old_value": "100% current Axis", "new_value": "50% current + 30% league + 20% random", "type": "deterministic", "optimization_mode": "MACRO", "primary_metric": 0.80, "primary_metric_prev": 0.76, "delta": "n/a (just started, league not yet active)", "decision": "monitoring", "notes": "MACRO experiment implementing human priority #1. League pool stores Axis snapshots every 50 iterations. Random league model loaded each snapshot. Should produce more robust Allied strategies that generalize to different play styles (including James's dad)."}
{"id": 8, "timestamp": "2026-03-30T21:35:00Z", "hypothesis": "Monitoring check: too early to judge Exp #7 (league training). Only at iter 35/2000, league activates at iter 100. Allied at 80% is expected pre-league.", "variable": "none (monitoring)", "old_value": "n/a", "new_value": "n/a", "type": "deterministic", "optimization_mode": "GROWING_DATA", "primary_metric": 0.80, "primary_metric_prev": 0.80, "delta": "0.0", "decision": "keep", "notes": "Iter 35, 16k games. League OFF (0 snapshots). Speed 4.6k sps (down from 5.5k due to 5x Axis epochs). First league snapshot at iter 50, activation at iter 100. No intervention needed — let it reach league activation."}
{"id": 9, "timestamp": "2026-03-30T22:00:00Z", "hypothesis": "Pre-seeding league with 10 foundation Axis snapshots + shifting mix to 40/40/20 (current/league/random) gives Allied harder opponents from iteration 0. Foundation Axis played 282k games — much stronger than early-training snapshots.", "variable": "train_selfplay_v3.py (league pre-seed + mix ratio)", "old_value": "50/30/20 mix, empty league until iter 100", "new_value": "40/40/20 mix, 10 pre-seeded snapshots from foundation, active from iter 0", "type": "deterministic", "optimization_mode": "MICRO", "primary_metric": 0.81, "primary_metric_prev": 0.82, "delta": "-0.01 (early)", "decision": "monitoring", "notes": "League active immediately with 10 diverse snapshots. Allied at 81% at iter 10 — need 50+ iters to see full effect. The foundation snapshots represent different Axis skill levels from 282k games of training."}
{"id": 10, "timestamp": "2026-03-30T22:35:00Z", "hypothesis": "Monitoring: resumed from iter 200 checkpoint. League has 1 snapshot, activates at iter 250 (next snapshot). Allied at 85% expected pre-league.", "variable": "none (monitoring)", "old_value": "n/a", "new_value": "n/a", "type": "deterministic", "optimization_mode": "GROWING_DATA", "primary_metric": 0.85, "primary_metric_prev": 0.85, "delta": "0.0", "decision": "keep", "notes": "Resumed successfully with idempotent checkpoints. League saved 1 snap at iter 200, needs 1 more at iter 250 to activate. Old checkpoint format didn't include league/optimizer — new format does. Next check should show league active."}
{"id": 11, "timestamp": "2026-03-30T23:00:00Z", "hypothesis": "Monitoring: League active, Allied plateaued at 83%. Considered increasing terminal reward from ±100 to ±500, but decided NOT to interrupt overnight run. Optimizer momentum would be lost. Better to let it accumulate 1.7M+ games and make changes in the morning.", "variable": "none (monitoring)", "old_value": "n/a", "new_value": "n/a", "type": "deterministic", "optimization_mode": "GROWING_DATA", "primary_metric": 0.83, "primary_metric_prev": 0.85, "delta": "-0.02", "decision": "keep", "notes": "Crossed 1M total games. League active with snapshots from iter 200-400. Win rate dropped slightly (85→83%) since league activation — the diversity IS helping, just slowly. Overnight run should reach iter 2000 / ~900k games this run / ~1.7M total. NEXT MORNING: try ±500 terminal reward or observation compression."}
{"id": 12, "timestamp": "2026-03-30T23:30:00Z", "hypothesis": "Monitoring: Allied slowly dropping (84→83→82%) with league active. Trend is correct, just slow. Don't interrupt overnight run.", "variable": "none (monitoring)", "old_value": "n/a", "new_value": "n/a", "type": "deterministic", "optimization_mode": "GROWING_DATA", "primary_metric": 0.82, "primary_metric_prev": 0.83, "delta": "-0.01", "decision": "keep", "notes": "1.1M total games. Iter 640/2000. League active with ~8 snapshots. Win rate dropping ~1% per 200 iters. ETA to 70%: ~2400 more iters (not this run). Morning plan: increase terminal reward or compress observations."}
{"id": 13, "timestamp": "2026-03-31T00:00:00Z", "hypothesis": "Monitoring: overnight run healthy. Allied 81%, down from 84% at league activation. Consistent -1% per 200 iters. League has ~12 snapshots.", "variable": "none (monitoring)", "old_value": "n/a", "new_value": "n/a", "type": "deterministic", "optimization_mode": "GROWING_DATA", "primary_metric": 0.81, "primary_metric_prev": 0.82, "delta": "-0.01", "decision": "keep", "notes": "1.21M total games. Iter 865/2000. Overnight stable at 4k sps. Projected 75% at iter 2000. Morning actions: (1) increase terminal reward ±100→±500, (2) or compress observations, (3) or bigger network. The slow convergence suggests the 8.9M param model may be near its capacity for this observation size."}
{"id": 14, "timestamp": "2026-03-31T00:30:00Z", "hypothesis": "Monitoring: Allied plateaued at 81% for 450 iterations (iter 640-1090). League diversity alone not enough. 2h remaining — let it finish, then intervene.", "variable": "none (monitoring)", "old_value": "n/a", "new_value": "n/a", "type": "deterministic", "optimization_mode": "GROWING_DATA", "primary_metric": 0.81, "primary_metric_prev": 0.81, "delta": "0.0", "decision": "keep", "notes": "1.3M total games. Plateau confirmed at 81% for 450 iters. League has ~16 snapshots but they're all similar skill level. MORNING PLAN (priority order): (1) Increase terminal reward ±100→±500 to make win/loss the dominant signal. (2) If still stuck, compress observation from 16k→2k dims. (3) If still stuck, try SAC instead of PPO."}
{"id": 15, "timestamp": "2026-03-31T01:05:00Z", "hypothesis": "Monitoring: 81% for 675 iterations. Plateau is firm. Checkpoints growing to 924MB due to league pool (20+ snapshots). Run completes in ~1.4h.", "variable": "none (monitoring)", "old_value": "n/a", "new_value": "n/a", "type": "deterministic", "optimization_mode": "GROWING_DATA", "primary_metric": 0.81, "primary_metric_prev": 0.81, "delta": "0.0", "decision": "keep", "notes": "1.4M total games. Iter 1315/2000. 81% plateau for 675 iters is definitive — current architecture + hyperparams have converged. The league pool and trained weights are the valuable outputs. MORNING: terminal reward boost is experiment #1 priority."}
{"id": 16, "timestamp": "2026-03-31T01:35:00Z", "hypothesis": "Monitoring: Allied dropped to 80% — first movement in 900 iters. League pool (~24 snapshots) finally creating enough diversity. 55 min to completion.", "variable": "none (monitoring)", "old_value": "n/a", "new_value": "n/a", "type": "deterministic", "optimization_mode": "GROWING_DATA", "primary_metric": 0.80, "primary_metric_prev": 0.81, "delta": "-0.01", "decision": "keep", "notes": "1.49M total games. Allied 80%, down from 81% plateau. Trend resuming at iter 1545. Final model at iter 2000 will have ~900k games this run, 1.7M total, 28+ league snapshots. Best model yet."}
{"id": 17, "timestamp": "2026-03-31T02:05:00Z", "hypothesis": "Monitoring: 30 min to completion. Allied stable at 80%. Prepared terminal reward change (±100→±500) for morning — 8 locations in lib.rs identified. Ready to execute immediately when run finishes.", "variable": "none (preparation)", "old_value": "n/a", "new_value": "n/a", "type": "deterministic", "optimization_mode": "GROWING_DATA", "primary_metric": 0.80, "primary_metric_prev": 0.80, "delta": "0.0", "decision": "keep", "notes": "1.59M total games. Iter 1775/2000. ~27 league snapshots. Morning experiment prepared: change ±100 to ±500 terminal reward at 8 locations in rust_engine/src/lib.rs, rebuild, resume from final checkpoint."}
{"id": 18, "timestamp": "2026-03-31T02:40:00Z", "hypothesis": "Terminal reward ±100→±500 makes win/loss 5x more important than VC accumulation. Should push both agents to focus on actually winning, not just territory grabbing. Resumed from overnight final checkpoint with 30-snapshot league.", "variable": "rust_engine/src/lib.rs (8 locations: 100.0→500.0)", "old_value": "±100.0", "new_value": "±500.0", "type": "deterministic", "optimization_mode": "MACRO", "primary_metric": 0.75, "primary_metric_prev": 0.80, "delta": "-0.05", "decision": "monitoring", "notes": "IMMEDIATE IMPACT: Allied dropped from 80%→75% within first 15 iterations. Resumed from selfplay_final.pt (iter 2000, 850k games, 30 league snapshots). Running 4000 iters. Total all-time: ~1.68M+ games. This is the breakthrough we've been waiting for."}
{"id": 19, "timestamp": "2026-03-31T03:05:00Z", "hypothesis": "Monitoring: ±500 terminal reward bounced back to 80% after initial 75% drop. Expected — critic needs 500-1000 iters to recalibrate value estimates to new reward scale. Let it train.", "variable": "none (monitoring)", "old_value": "n/a", "new_value": "n/a", "type": "deterministic", "optimization_mode": "GROWING_DATA", "primary_metric": 0.80, "primary_metric_prev": 0.75, "delta": "+0.05 (transient bounce)", "decision": "keep", "notes": "1.86M total games. Iter 425/4000. The 75%→80% bounce is the optimizer recalibrating to 5x reward scale. Real effect won't be visible until iter 800+. Training healthy at 4.2k sps."}
{"id": 20, "timestamp": "2026-03-31T03:35:00Z", "hypothesis": "Monitoring: ±500 reward settled at 81%. Same plateau. About to cross 2M total games. The 80-81% ceiling has persisted for ~1M games across 6 experiments — this is an architectural limit, not hyperparameter.", "variable": "none (monitoring)", "old_value": "n/a", "new_value": "n/a", "type": "deterministic", "optimization_mode": "GROWING_DATA", "primary_metric": 0.81, "primary_metric_prev": 0.80, "delta": "+0.01", "decision": "keep", "notes": "1.98M total games. Plateau at 80-81% is definitive across experiments #4-18. MORNING DISCUSSION NEEDED: (1) Compress observation 16k→2k (remove distant/irrelevant territories), (2) Double network size 512→1024 hidden, (3) Add attention mechanism for territory relevance, (4) Try SAC algorithm. These are architectural changes that need user review."}
{"id": 21, "timestamp": "2026-03-31T04:05:00Z", "hypothesis": "Extreme Axis bid +60 PUs (Germany 65, Japan 51, Italy 22) as stress test. If even this doesn't break 81%, the ceiling is architectural. If it does, the agent just needs a harder opponent.", "variable": "train_phase2.py:30-32 (Axis bid)", "old_value": "+38 (J+13, G+17, I+8)", "new_value": "+60 (J+20, G+28, I+12)", "type": "deterministic", "optimization_mode": "MICRO", "primary_metric": 0.82, "primary_metric_prev": 0.82, "delta": "0.0 (just started, bid not yet in effect)", "decision": "monitoring", "notes": "2.07M total games. Resumed from iter 900 checkpoint. The +60 bid only affects games after env reset — need ~50 iters for full effect. Germany at 65 PUs can buy fighter+3armor+4infantry every round. If Allied still at 80%+ after 200 iters, ceiling is confirmed architectural."}
{"id": 22, "timestamp": "2026-03-31T04:35:00Z", "hypothesis": "CONFIRMED: +60 PU bid had zero effect. Allied still 82% after 185 iterations. The 80-82% ceiling is definitively ARCHITECTURAL — the 8.9M param MLP on 16k observations has converged.", "variable": "none (conclusion)", "old_value": "n/a", "new_value": "n/a", "type": "deterministic", "optimization_mode": "MACRO", "primary_metric": 0.82, "primary_metric_prev": 0.82, "delta": "0.0", "decision": "keep", "notes": "2.15M total games. 12 experiments across bid/reward/training/league all failed to break 80%. ARCHITECTURAL CHANGE REQUIRED. Options for morning: (1) Observation compression 16k→2k — remove 97 impassable/irrelevant territory slots, only encode frontline+factory+capital territories. Reduces first layer from 8.3M to ~1M params, letting remaining capacity focus on strategy. (2) Double hidden size 512→1024. (3) Add attention over territories. Recommend option 1 first — simpler and addresses the root cause (signal buried in noise)."}
{"id": 23, "timestamp": "2026-03-31T05:05:00Z", "hypothesis": "Monitoring: 82% unchanged. 395 iters with +60 bid. Architectural ceiling confirmed. Training continues accumulating league snapshots (~20 now). No intervention — waiting for morning architectural discussion.", "variable": "none", "old_value": "n/a", "new_value": "n/a", "type": "deterministic", "optimization_mode": "GROWING_DATA", "primary_metric": 0.82, "primary_metric_prev": 0.82, "delta": "0.0", "decision": "keep", "notes": "~2.24M total games. Iter 1295/4000. The training is still useful — each iteration adds league diversity and refines weights within the current capacity. But no win rate improvement possible without architectural change."}
{"id": 24, "timestamp": "2026-03-31T05:35:00Z", "hypothesis": "Monitoring: 81%. Normal oscillation within 80-82% band. 2.33M total games. No action.", "variable": "none", "old_value": "n/a", "new_value": "n/a", "type": "deterministic", "optimization_mode": "GROWING_DATA", "primary_metric": 0.81, "primary_metric_prev": 0.82, "delta": "-0.01", "decision": "keep", "notes": "Iter 1495/4000. ~23 league snapshots. ETA ~3h to completion. Training accumulating experience within architectural capacity. Morning plan unchanged: observation compression is the priority."}
{"id": 25, "timestamp": "2026-03-31T06:05:00Z", "hypothesis": "Monitoring: 81%, 2.41M games, iter 1700/4000. Stable. ~2h remaining.", "variable": "none", "old_value": "n/a", "new_value": "n/a", "type": "deterministic", "optimization_mode": "GROWING_DATA", "primary_metric": 0.81, "primary_metric_prev": 0.81, "delta": "0.0", "decision": "keep", "notes": "Overnight run proceeding. ~25 league snapshots. Model is the most trained version yet — 2.41M games of experience. Even at 81% ceiling, this is a strong Allied agent for the HUD recommender."}
{"id": 26, "timestamp": "2026-03-31T06:35:00Z", "hypothesis": "Monitoring: 81%, 2.5M total games. Iter 1905/4000 — nearing completion of this segment. ~25 min remaining.", "variable": "none", "old_value": "n/a", "new_value": "n/a", "type": "deterministic", "optimization_mode": "GROWING_DATA", "primary_metric": 0.81, "primary_metric_prev": 0.81, "delta": "0.0", "decision": "keep", "notes": "About to hit 2.5M games milestone. Run should complete around iter 4000 at ~7:30. Will save final checkpoint with ~28 league snapshots. Best model yet for HUD recommender despite 81% ceiling."}
{"id": 27, "timestamp": "2026-03-31T07:05:00Z", "hypothesis": "Monitoring: 81%, 2.59M games. Passed original iter 2000 target, continuing to 4000. Checkpoint saved at 2000 and 2100.", "variable": "none", "old_value": "n/a", "new_value": "n/a", "type": "deterministic", "optimization_mode": "GROWING_DATA", "primary_metric": 0.81, "primary_metric_prev": 0.81, "delta": "0.0", "decision": "keep", "notes": "Overnight run stable. 28+ league snapshots. Model at iter 2115. At current rate (4k sps), iter 4000 completes around ~10 AM. MORNING SUMMARY: 26 auto-research iterations, 12 unique experiments, 2.59M total games. Architectural ceiling at 81% confirmed. Ready for observation compression when user wakes."}
{"id": 28, "timestamp": "2026-03-31T07:35:00Z", "hypothesis": "Monitoring: 81%, 2.67M games. Used this iteration to draft detailed observation compression plan (experiments/obs_compression_plan.md). Ready for implementation.", "variable": "none (preparation)", "old_value": "n/a", "new_value": "n/a", "type": "deterministic", "optimization_mode": "MACRO", "primary_metric": 0.81, "primary_metric_prev": 0.81, "delta": "0.0", "decision": "keep", "notes": "Drafted 4-step compression plan: (1) remove 15 impassable territories, (2) compress per-player units to friendly/enemy sums, (3) add strategic features (frontline, distance), (4) optionally only encode relevant territories. Reduces obs from 16k to 2.5-6.5k dims. First layer drops from 8.3M to 1.3M params. Plan saved to experiments/obs_compression_plan.md."}
{"id": 29, "timestamp": "2026-03-31T08:05:00Z", "hypothesis": "Monitoring: Training stopped by user for gameplay. Latest checkpoint: selfplay_final.pt (iter 2000, overnight run). The rust_engine/checkpoints_phase2/ checkpoints from the +60 bid run were lost during cleanup. Main checkpoints_phase2/ has the overnight model intact.", "variable": "none", "old_value": "n/a", "new_value": "n/a", "type": "deterministic", "optimization_mode": "GROWING_DATA", "primary_metric": 0.81, "primary_metric_prev": 0.81, "delta": "0.0", "decision": "keep", "notes": "Training paused. User preparing to play against dad. Repo cleaned and published as open source. Best model: checkpoints_phase2/selfplay_final.pt (2M games, 81% vs +60 bid Axis with league). No action needed until user requests more training."}
