{"id": 57, "timestamp": "2026-03-31T16:55:00Z", "hypothesis": "Post-league convergence: win rate plateaued at 74.5% (was climbing +0.4%/5iter pre-league, now +0.1%/5iter). League stopped the climb but didn't push it down. Only 90k games — V2 didn't plateau until 2.7M games. Too early to call ceiling.", "variable": "none (monitoring post-league)", "old_value": "n/a", "new_value": "n/a", "type": "deterministic", "optimization_mode": "GROWING_DATA", "primary_metric": 0.745, "primary_metric_prev": 0.742, "delta": "+0.003", "decision": "keep", "notes": "Iter 115, 90177 games, 1904 sps, GPU 83%. Win rate flat at 74.3-74.5% post-league. League providing stability — third forward pass pushed GPU to 83%. V2 comparison: 81% at 2.7M games. V3 at 74.5% with 90k games — only 3.3% of V2's training. Far too early to judge ceiling. Let it train."}
