{"id": 30, "timestamp": "2026-03-31T08:35:00Z", "hypothesis": "V3 GNN+Attention architecture (690k params vs 8.9M) should break the 81% ceiling by matching network structure to problem structure. Territory-aware processing via graph convolutions + attention pooling.", "variable": "src/network.py (ActorCriticV2 → ActorCriticV3)", "old_value": "Flat MLP 8.9M params on 16k dims", "new_value": "GNN+Attention 690k params: TerritoryEncoder → 3x GNN layers → AttentionPool → separate heads", "type": "deterministic", "optimization_mode": "MACRO", "primary_metric": null, "primary_metric_prev": 0.81, "delta": "n/a (not yet trained)", "decision": "monitoring", "notes": "Architecture change. Fixed league pre-seeding for V2/V3 compatibility. Ready to train from scratch. Previous V2 model (2.7M games, 81%) available on main branch for HUD play."}
{"id": 31, "timestamp": "2026-03-31T09:05:00Z", "hypothesis": "Monitoring: No training running. User paused to discuss V3 architecture and business opportunities. V3 (GNN+Attention, 690k params) is ready to train on feature/attention-gnn-architecture branch. League pre-seeding compatibility fixed.", "variable": "none", "old_value": "n/a", "new_value": "n/a", "type": "deterministic", "optimization_mode": "GROWING_DATA", "primary_metric": 0.81, "primary_metric_prev": 0.81, "delta": "0.0", "decision": "keep", "notes": "Training idle. V2 best model: 2.7M games, 81% ceiling. V3 architecture built but untrained. Waiting for user to resume. Current branch: feature/attention-gnn-architecture."}
{"id": 32, "timestamp": "2026-03-31T09:35:00Z", "hypothesis": "Monitoring: Training idle. User exploring TTS/Asmodee business opportunity. V3 architecture ready on feature branch. No action needed until user decides to resume training or pivot to a new game engine.", "variable": "none", "old_value": "n/a", "new_value": "n/a", "type": "deterministic", "optimization_mode": "GROWING_DATA", "primary_metric": 0.81, "primary_metric_prev": 0.81, "delta": "0.0", "decision": "keep", "notes": "Training paused. Key assets: (1) V2 model trained on 2.7M games at 81% ceiling, (2) V3 GNN architecture ready to train, (3) Rust engine framework proven for A&A, (4) Auto-research pipeline with 32 experiments logged. Potential next steps: train V3, build Risk/Catan engine, or build TTS Lua bridge."}
{"id": 33, "timestamp": "2026-03-31T10:05:00Z", "hypothesis": "Monitoring: Training idle. User documented TTS business idea in knowledge base. V3 architecture ready on feature branch. No training to monitor.", "variable": "none", "old_value": "n/a", "new_value": "n/a", "type": "deterministic", "optimization_mode": "GROWING_DATA", "primary_metric": 0.81, "primary_metric_prev": 0.81, "delta": "0.0", "decision": "keep", "notes": "Idle. Awaiting user direction: train V3, build second game engine (Risk), or build TTS Lua bridge."}
{"id": 34, "timestamp": "2026-03-31T18:30:00Z", "hypothesis": "V3 GNN+Attention architecture (690k params) training from scratch on Mac Studio. Fresh conda env + Rust engine build. With +60 PU Axis bid, ±500 terminal reward, 5x Axis epochs, 0.05 Axis entropy, league training. Should break the V2 81% ceiling by matching network structure to territory graph.", "variable": "Full architecture: V2 MLP 8.9M → V3 GNN+Attention 690k", "old_value": "ActorCriticV2 (8.9M params, flat MLP)", "new_value": "ActorCriticV3 (690k params, GNN 3-layer + 4-head attention + per-territory heads)", "type": "deterministic", "optimization_mode": "MACRO", "primary_metric": 0.80, "primary_metric_prev": 0.81, "delta": "-0.01 (early, iter 0)", "decision": "monitoring", "notes": "Fresh start on Mac Studio. Installed miniforge + rl-triplea env. 339 sps at iter 0 (GPU 86%, Rust 11%). Allied 80% at 353 games. League inactive (no snapshots yet). ETA ~53h for 2000 iters. Next check in 30 min."}
{"id": 35, "timestamp": "2026-03-31T12:30:00Z", "hypothesis": "Post-reboot monitoring: Mac Studio rebooted at 11:22 AM (likely macOS 26.3 critical update). Training was manually restarted at 12:14 PM. V3 at iteration 10: 76% win rate, 490 sps, GPU 80%. Axis is learning (dropped from 85% → 76%). No action needed — wait 50+ iters.", "variable": "none (monitoring)", "old_value": "n/a", "new_value": "n/a", "type": "deterministic", "optimization_mode": "GROWING_DATA", "primary_metric": 0.759, "primary_metric_prev": 0.80, "delta": "-0.041 (Axis learning, expected)", "decision": "keep", "notes": "Iter 10, 2079 games, 490 sps, GPU 80%. Win rate 76% is above sweet spot (55-70%) but only 10 iters in — Axis still learning. Speed is great (490 sps >> 300 threshold). Re-enabling auto-research cron after reboot."}
{"id": 36, "timestamp": "2026-03-31T13:00:00Z", "hypothesis": "Float16 autocast + torch.compile should speed up V3 GNN training on M4 Max by reducing memory bandwidth for matmuls", "variable": "Mixed precision (float16 autocast + torch.compile)", "old_value": "float32 only, no compile", "new_value": "float16 autocast + torch.compile", "type": "deterministic", "optimization_mode": "MACRO", "primary_metric": null, "primary_metric_prev": 0.759, "delta": "FAILED", "decision": "discard", "notes": "FAILED. torch.compile + autocast crashes MPS (type mismatch in compiled Metal graph). Autocast alone causes NaN explosion in GNN attention (float16 can't handle -inf masking + softmax). Even before NaN, was slower (404 sps vs 490 sps) — 690k param model is too small for mixed precision to help. Type conversion overhead dominates savings. Reverted to clean float32."}
{"id": 37, "timestamp": "2026-03-31T13:15:00Z", "hypothesis": "5 architecture optimizations should dramatically speed up V3: (1) sparse message passing instead of dense O(T²) attention, (2) 2 GNN layers instead of 3, (3) embed dim 64 instead of 128, (4) remove dead W_msg weight, (5) pre-computed normalized adjacency", "variable": "GNN architecture (dense attention → sparse message passing, 3→2 layers, 128→64 embed)", "old_value": "Dense attention GNN, 3 layers, 128 embed, 690k params, 500 sps at 64 envs", "new_value": "Sparse message-passing GNN, 2 layers, 64 embed, 117k params, 2614 sps at 256 envs", "type": "deterministic", "optimization_mode": "MACRO", "primary_metric": 0.753, "primary_metric_prev": 0.812, "delta": "n/a (fresh start, not comparable yet)", "decision": "monitoring", "notes": "5.2x speedup (500→2614 sps). GPU dropped from 80% to 57% — bottleneck shifted to Rust engine (36%). Bumped to 256 envs. 117k params (83% reduction from 690k). Adjacency is 97% sparse (5 neighbors avg per territory) — old GNN was computing 32x wasted attention scores. Need 50+ iterations to judge learning quality."}
{"id": 38, "timestamp": "2026-03-31T13:20:00Z", "hypothesis": "Monitoring: New sparse GNN V3 (117k params, 2 layers, 64 embed) training at 2605 sps with 256 envs. GPU 53%, Rust 39%. Allied 77% at 4.6k games — too early to judge (need 50+ iters).", "variable": "none (monitoring)", "old_value": "n/a", "new_value": "n/a", "type": "deterministic", "optimization_mode": "GROWING_DATA", "primary_metric": 0.767, "primary_metric_prev": 0.753, "delta": "+0.014", "decision": "keep", "notes": "Iter 5, 4587 games, 2605 sps, GPU 53%, Rust 39%. Bottleneck is now Rust engine. Win rate 77% but only 5 iters — Axis barely learning. Auto-research loop enabled (10 min cadence)."}
{"id": 39, "timestamp": "2026-03-31T13:35:00Z", "hypothesis": "Monitoring: Sparse GNN V3 (117k params) fresh start with 256 envs. Allied 68% at iter 0 — already in sweet spot! Previous dense GNN V3 started at 75-85% and took time to drop.", "variable": "none (monitoring)", "old_value": "n/a", "new_value": "n/a", "type": "deterministic", "optimization_mode": "GROWING_DATA", "primary_metric": 0.684, "primary_metric_prev": null, "delta": "n/a (fresh start)", "decision": "keep", "notes": "Iter 0, 642 games, 2568 sps, GPU 55%, Rust 38%. Win rate 68% at iter 0 is great — in sweet spot immediately. Sparse GNN seems to produce more balanced initial play. Need 50+ iters to confirm. Rust engine is bottleneck (16 CPU cores maxed via Rayon). No action."}
{"id": 40, "timestamp": "2026-03-31T14:05:00Z", "hypothesis": "Async pipeline (PPO in background thread + vectorized league + removed sync) should overlap GPU PPO training with Rust env stepping for higher throughput", "variable": "Training pipeline (sync → async PPO thread + vectorized league assignment)", "old_value": "Sequential: rollout then PPO, Python for-loop league, explicit mps.synchronize(). 2600 sps, GPU 55%, Rust 38%", "new_value": "Async: PPO in daemon thread overlaps next rollout, vectorized league with torch ops, no explicit sync. 3020 sps, GPU 72%, Rust 19%", "type": "deterministic", "optimization_mode": "MACRO", "primary_metric": 0.67, "primary_metric_prev": 0.684, "delta": "n/a (fresh start)", "decision": "keep", "notes": "16% speedup (2600→3020 sps). GPU now 72% utilized (was 55%). Rust dropped to 19% because it overlaps with PPO. Both PyTorch GPU ops and Rust/pyo3 release the GIL, enabling true thread parallelism on MPS. Allied 67% in sweet spot. Cumulative speedup from V3 dense: 500 → 3020 sps = 6x."}
{"id": 41, "timestamp": "2026-03-31T14:15:00Z", "hypothesis": "Monitoring: Sparse GNN V3 with async pipeline training steadily. Win rate stable at 67-68% (sweet spot). Waiting for 50+ iterations.", "variable": "none (monitoring)", "old_value": "n/a", "new_value": "n/a", "type": "deterministic", "optimization_mode": "GROWING_DATA", "primary_metric": 0.675, "primary_metric_prev": 0.67, "delta": "+0.005", "decision": "keep", "notes": "Iter 10, 7709 games, 2816 sps, GPU 72%, Rust 19%. Win rate stable 67-68% across iters 0-10. Async pipeline working well. Need 40 more iters to judge architecture quality. No action."}
{"id": 42, "timestamp": "2026-03-31T14:25:00Z", "hypothesis": "Monitoring: Win rate stable at 67-68% through iters 0-20. Slight upward trend suggests Allied learning marginally faster than Axis. Speed steady at 2716 sps.", "variable": "none (monitoring)", "old_value": "n/a", "new_value": "n/a", "type": "deterministic", "optimization_mode": "GROWING_DATA", "primary_metric": 0.679, "primary_metric_prev": 0.675, "delta": "+0.004", "decision": "keep", "notes": "Iter 20, 14912 games, 2716 sps, GPU 72%, Rust 19%. Win rate trend: 71%→67%→68%→68% (stable sweet spot). 30 more iters to 50-iter threshold. No action."}
{"id": 43, "timestamp": "2026-03-31T14:35:00Z", "hypothesis": "Monitoring: Win rate trending up past sweet spot ceiling — 68%→69%→70%→71%. Allied learning faster than Axis. League activates at iter 50 (first snapshot) which should add opponent diversity and push win rate back down.", "variable": "none (monitoring)", "old_value": "n/a", "new_value": "n/a", "type": "deterministic", "optimization_mode": "GROWING_DATA", "primary_metric": 0.707, "primary_metric_prev": 0.679, "delta": "+0.028", "decision": "monitoring", "notes": "Iter 45, 33284 games, 2659 sps, GPU 72%. Win rate 70.7% — just above sweet spot (55-70%). Trend is clearly upward. League snapshot at iter 50 will activate league diversity (40% current, 40% past, 20% random). If win rate continues above 80% after league activation, will increase Axis bid. 5 more iters to threshold."}
{"id": 44, "timestamp": "2026-03-31T14:45:00Z", "hypothesis": "Win rate climbing above sweet spot (72.7%) because league is NOT YET ACTIVE (1 snapshot, needs 2). League activates at iter 100 with second snapshot. Expect win rate to drop when facing diverse opponents (40% current + 40% past + 20% random).", "variable": "none (monitoring)", "old_value": "n/a", "new_value": "n/a", "type": "deterministic", "optimization_mode": "GROWING_DATA", "primary_metric": 0.727, "primary_metric_prev": 0.707, "delta": "+0.020", "decision": "monitoring", "notes": "Iter 70, 52248 games, 2641 sps, GPU 72%. Win rate trend: 68→70→71→72→73%. League has 1 snapshot (iter 50), needs 2 for activation (iter 100). No action — this is expected pre-league behavior. Will reassess at iter 150 (50 iters after league activation). If still >75%, increase Axis bid +4 PUs."}
{"id": 45, "timestamp": "2026-03-31T14:55:00Z", "hypothesis": "Monitoring: Win rate at 74% climbing ~0.3%/5 iters. League activates at iter 100 (5 iters away). Expect 5-10% win rate drop from opponent diversity.", "variable": "none (monitoring)", "old_value": "n/a", "new_value": "n/a", "type": "deterministic", "optimization_mode": "GROWING_DATA", "primary_metric": 0.74, "primary_metric_prev": 0.727, "delta": "+0.013", "decision": "monitoring", "notes": "Iter 95, 71679 games, 2632 sps, GPU 72%. Win rate 74% — above sweet spot but league activation imminent at iter 100. 50-iter milestone reached for sparse GNN architecture. Architecture is clearly learning (68%→74% in 95 iters, 72k games). Speed stable. Next check should see league active."}
{"id": 46, "timestamp": "2026-03-31T15:05:00Z", "hypothesis": "Increasing Axis PPO epochs from 3x to 5x (12→20 epochs) should strengthen the Axis opponent and push Allied win rate from 75% back toward the 55-70% sweet spot. League active with 2 snapshots.", "variable": "Axis PPO epochs multiplier", "old_value": "3x (12 epochs)", "new_value": "5x (20 epochs)", "type": "deterministic", "optimization_mode": "MICRO", "primary_metric": 0.749, "primary_metric_prev": 0.742, "delta": "+0.007 (pre-change trend)", "decision": "monitoring", "notes": "Iter 115, 87k games. Win rate 74.9% and climbing even with league active (iter 100). League barely dented the trend (74.2→74.9%). Axis needs more training capacity. 5x epochs = 67% more Axis gradient steps per iteration. Resumed from iter 100 checkpoint. Expect win rate drop in 20-30 iters. Will also slow training slightly (more PPO work per iter)."}
{"id": 47, "timestamp": "2026-03-31T15:15:00Z", "hypothesis": "Monitoring: 5x Axis PPO epochs showing early positive signal — win rate trend flattened from +0.3%/5iter to +0.1%/5iter. GPU up to 82% (was 72%) from extra Axis training work.", "variable": "none (monitoring post Axis 5x)", "old_value": "n/a", "new_value": "n/a", "type": "deterministic", "optimization_mode": "GROWING_DATA", "primary_metric": 0.746, "primary_metric_prev": 0.749, "delta": "-0.003", "decision": "monitoring", "notes": "Iter 110 (10 iters post-change), 83842 games, GPU 82%, league active (3 snapshots). Win rate flatlined at 74.4-74.6% — was climbing at +0.3%/5iter before. Axis learning faster with 5x epochs. Need 40 more iters to confirm. SPS numbers inflated due to restart — real throughput estimated ~2400 sps from timing breakdown."}
{"id": 48, "timestamp": "2026-03-31T15:25:00Z", "hypothesis": "Monitoring: 5x Axis PPO epochs stabilized win rate at ~75% (was climbing before). Plateau confirmed over 25 iterations post-change. Axis keeping pace but not gaining.", "variable": "none (monitoring post Axis 5x)", "old_value": "n/a", "new_value": "n/a", "type": "deterministic", "optimization_mode": "GROWING_DATA", "primary_metric": 0.75, "primary_metric_prev": 0.746, "delta": "+0.004", "decision": "monitoring", "notes": "Iter 125, 95366 games, GPU 82%, league active (3 snapshots). Win rate plateau at 74.8-75.0% for 15 iters. Before 5x change was climbing +0.3%/5iter, now essentially flat. 5x epochs working but settled above sweet spot. 25 more iters to 50-iter threshold (iter 150). If still 75%+ at iter 150, will increase Axis bid +4 PUs."}
{"id": 49, "timestamp": "2026-03-31T15:35:00Z", "hypothesis": "Monitoring: Win rate creeping up again (75.0→75.3%) despite 5x Axis epochs + league. 5x epochs slowed the climb but didn't stop it. Will increase Axis bid +4 PUs at iter 150.", "variable": "none (monitoring post Axis 5x)", "old_value": "n/a", "new_value": "n/a", "type": "deterministic", "optimization_mode": "GROWING_DATA", "primary_metric": 0.753, "primary_metric_prev": 0.75, "delta": "+0.003", "decision": "monitoring", "notes": "Iter 135, 103k games, GPU 82%, league active (3 snapshots). Win rate drifting up: 75.0→75.2→75.3%. 5x Axis epochs insufficient alone. Next action at iter 150: increase Axis bid +4 PUs (currently +60, will become +64). 15 iters away (~8 min)."}
{"id": 50, "timestamp": "2026-03-31T15:45:00Z", "hypothesis": "CRITICAL FINDING: Previous training had NO Axis bid (train_selfplay.py doesn't include it, only train_phase2.py does). Allied 75.7% was against standard Axis with no bonus. Adding +64 PU Axis bid (was +60 in V2) should drop win rate significantly toward sweet spot. Also kept 5x Axis PPO epochs.", "variable": "Axis bid PUs", "old_value": "0 (no bid — was missing from train_selfplay.py!)", "new_value": "+64 PUs (Japanese +20, Germans +28, Italians +16)", "type": "deterministic", "optimization_mode": "MICRO", "primary_metric": 0.70, "primary_metric_prev": 0.757, "delta": "-0.057 (iter 0, early)", "decision": "monitoring", "notes": "Fresh start with bid. Allied dropped from 75.7% (no bid) to 70% (with +64 bid) at iter 0. The missing bid explains why Allied was so dominant — not an architecture issue. Sparse GNN V3 + async pipeline + 5x Axis epochs + 64 PU bid. Need 50 iters to judge."}
{"id": 51, "timestamp": "2026-03-31T15:55:00Z", "hypothesis": "Monitoring: +64 PU Axis bid working well. Win rate in sweet spot at 68-69%. Axis bid providing proper challenge.", "variable": "none (monitoring post bid)", "old_value": "n/a", "new_value": "n/a", "type": "deterministic", "optimization_mode": "GROWING_DATA", "primary_metric": 0.692, "primary_metric_prev": 0.703, "delta": "-0.011", "decision": "keep", "notes": "Iter 15, 12072 games, 2009 sps, GPU 71%. Win rate 69.2% — in sweet spot! Trend: 70%→68%→69%→69%. Bid dropped win rate from 75.7% (no bid) to 68-69% (with +64 bid). Speed dropped from 2600→2000 sps due to 5x Axis epochs (more GPU work). 35 more iters to threshold. No action."}
{"id": 52, "timestamp": "2026-03-31T16:05:00Z", "hypothesis": "Monitoring: Win rate drifting above sweet spot again (70.6%). Same pre-league pattern but slower climb than without bid (0.4%/5iter vs 0.6%/5iter). Bid is helping but Allied still outpaces Axis.", "variable": "none (monitoring)", "old_value": "n/a", "new_value": "n/a", "type": "deterministic", "optimization_mode": "GROWING_DATA", "primary_metric": 0.706, "primary_metric_prev": 0.692, "delta": "+0.014", "decision": "monitoring", "notes": "Iter 30, 23671 games, 1955 sps, GPU 71%. Win rate 70.6% — just above sweet spot. Trend slower than no-bid run (+0.4%/5iter vs +0.6%). League snapshot at iter 50, activation at iter 100. 20 more iters to 50-iter threshold. No action — wait for league."}
{"id": 53, "timestamp": "2026-03-31T16:15:00Z", "hypothesis": "50-iter assessment: +64 PU bid helped (started 68% vs 75% without) but Allied still outpacing Axis at +0.4%/5iter. Win rate 72.3%. League snapshot 1 saved, activation at iter 100. Holding for league.", "variable": "none (50-iter assessment)", "old_value": "n/a", "new_value": "n/a", "type": "deterministic", "optimization_mode": "GROWING_DATA", "primary_metric": 0.723, "primary_metric_prev": 0.706, "delta": "+0.017", "decision": "keep", "notes": "Iter 50, 39340 games, 1934 sps, GPU 71%. 50-iter mark for +64 bid. Bid dropped initial win rate by ~7% (75%→68%) but Allied climbing at +0.4%/5iter. League activates at iter 100. Next decision point: iter 150. If >75%, increase bid to +68."}
{"id": 54, "timestamp": "2026-03-31T16:25:00Z", "hypothesis": "Monitoring: Steady climb +0.3%/5iter. Win rate 73.2%. League activation at iter 100 (35 iters away). No action.", "variable": "none (monitoring)", "old_value": "n/a", "new_value": "n/a", "type": "deterministic", "optimization_mode": "GROWING_DATA", "primary_metric": 0.732, "primary_metric_prev": 0.723, "delta": "+0.009", "decision": "keep", "notes": "Iter 65, 51031 games, 1926 sps, GPU 72%. Predictable climb. 51k games trained with sparse GNN V3 + 64 PU bid + 5x Axis epochs. League activates iter 100. No action."}
{"id": 55, "timestamp": "2026-03-31T16:35:00Z", "hypothesis": "Monitoring: Win rate climb decelerating — +0.3%/5iter dropped to +0.1%/5iter. Axis catching up with 5x epochs + 64 PU bid. May plateau near 74%. League at iter 100.", "variable": "none (monitoring)", "old_value": "n/a", "new_value": "n/a", "type": "deterministic", "optimization_mode": "GROWING_DATA", "primary_metric": 0.737, "primary_metric_prev": 0.732, "delta": "+0.005", "decision": "keep", "notes": "Iter 80, 62802 games, 1922 sps, GPU 72%. Climb decelerating: was +0.3%/5iter, now +0.1%/5iter. Axis learning to use extra PUs. League in 20 iters. If plateau at 74% + league drops to 70%, we're golden."}
{"id": 56, "timestamp": "2026-03-31T16:45:00Z", "hypothesis": "League activated at iter 100 with 2 snapshots. Win rate plateaued at 74.2% (+0.1%/5iter for 20 iters). League diversity should hold or push win rate down. Critical test: does sparse GNN V3 break the V2 81% ceiling or plateau earlier?", "variable": "none (league activation milestone)", "old_value": "league_active: false, 1 snapshot", "new_value": "league_active: true, 2 snapshots", "type": "deterministic", "optimization_mode": "GROWING_DATA", "primary_metric": 0.742, "primary_metric_prev": 0.737, "delta": "+0.005", "decision": "monitoring", "notes": "Iter 100, 78399 games, 1918 sps, GPU 72%. League activated! Win rate plateau at 74.2%. Config: sparse GNN V3 (117k), async pipeline, 5x Axis PPO, +64 PU bid, league (40/40/20). 78k games in ~2.5 hours. Next 50 iters will show if league breaks the plateau or if 74% is the sparse GNN ceiling."}
